
/dev/sdb:

ATA device, with non-removable media
	Model Number:       WDC WD5003ABYZ-011FA0                   
	Serial Number:      WD-WMAYP0DJA4KP
	Firmware Revision:  01.01S03
	Transport:          Serial, SATA 1.0a, SATA II Extensions, SATA Rev 2.5, SATA Rev 2.6, SATA Rev 3.0
Standards:
	Supported: 8 7 6 5 
	Likely used: 8
Configuration:
	Logical		max	current
	cylinders	16383	16383
	heads		16	16
	sectors/track	63	63
	--
	CHS current addressable sectors:   16514064
	LBA    user addressable sectors:  268435455
	LBA48  user addressable sectors:  976773168
	Logical/Physical Sector size:           512 bytes
	device size with M = 1024*1024:      476940 MBytes
	device size with M = 1000*1000:      500107 MBytes (500 GB)
	cache/buffer size  = unknown
	Nominal Media Rotation Rate: 7200
Capabilities:
	LBA, IORDY(can be disabled)
	Queue depth: 32
	Standby timer values: spec'd by Standard, with device specific minimum
	R/W multiple sector transfer: Max = 16	Current = 0
	Advanced power management level: 254
	DMA: mdma0 mdma1 mdma2 udma0 udma1 udma2 udma3 udma4 udma5 *udma6 
	     Cycle time: min=120ns recommended=120ns
	PIO: pio0 pio1 pio2 pio3 pio4 
	     Cycle time: no flow control=120ns  IORDY flow control=120ns
Commands/features:
	Enabled	Supported:
	   *	SMART feature set
	    	Security Mode feature set
	   *	Power Management feature set
	   *	Write cache
	   *	Look-ahead
	   *	Host Protected Area feature set
	   *	WRITE_BUFFER command
	   *	READ_BUFFER command
	   *	NOP cmd
	   *	DOWNLOAD_MICROCODE
	   *	Advanced Power Management feature set
	    	Power-Up In Standby feature set
	   *	SET_FEATURES required to spinup after power up
	    	SET_MAX security extension
	   *	48-bit Address feature set
	   *	Device Configuration Overlay feature set
	   *	Mandatory FLUSH_CACHE
	   *	FLUSH_CACHE_EXT
	   *	SMART error logging
	   *	SMART self-test
	   *	General Purpose Logging feature set
	   *	WRITE_{DMA|MULTIPLE}_FUA_EXT
	   *	64-bit World wide name
	   *	IDLE_IMMEDIATE with UNLOAD
	   *	WRITE_UNCORRECTABLE_EXT command
	   *	{READ,WRITE}_DMA_EXT_GPL commands
	   *	Segmented DOWNLOAD_MICROCODE
	    	unknown 119[7]
	   *	Gen1 signaling speed (1.5Gb/s)
	   *	Gen2 signaling speed (3.0Gb/s)
	   *	Gen3 signaling speed (6.0Gb/s)
	   *	Native Command Queueing (NCQ)
	   *	Phy event counters
	   *	Idle-Unload when NCQ is active
	   *	NCQ priority information
	   *	READ_LOG_DMA_EXT equivalent to READ_LOG_EXT
	   *	DMA Setup Auto-Activate optimization
	   *	Software settings preservation
	   *	SMART Command Transport (SCT) feature set
	   *	SCT Read/Write Long (AC1), obsolete
	   *	SCT Write Same (AC2)
	   *	SCT Error Recovery Control (AC3)
	   *	SCT Features Control (AC4)
	   *	SCT Data Tables (AC5)
	    	unknown 206[12] (vendor specific)
	    	unknown 206[13] (vendor specific)
Security: 
	Master password revision code = 65534
		supported
	not	enabled
	not	locked
	not	frozen
	not	expired: security count
		supported: enhanced erase
	82min for SECURITY ERASE UNIT. 82min for ENHANCED SECURITY ERASE UNIT. 
Logical Unit WWN Device Identifier: 50014ee0ae8d0ac7
	NAA		: 5
	IEEE OUI	: 0014ee
	Unique ID	: 0ae8d0ac7
Checksum: correct
